{
  "id": "anzsrc-2020-for-4505", "record_type": "coverage", "reference_system_id": "anzsrc-2020-for-indigenous-studies-groups",
  "candidate_id": "anzsrc-4505", "candidate_label": "Aboriginal and Torres Strait Islander peoples, society and community", "decision": "pending",
  "reason": "Registered from the complete Division 45 group inventory; psychology relevance and entity scope remain to be adjudicated.",
  "status": "retrieved", "publishable": false, "provenance": "reference_system"
}
