{
  "id": "anzsrc-2020-for-520502", "record_type": "coverage", "reference_system_id": "anzsrc-2020-for-psychology-fields",
  "candidate_id": "anzsrc-520502", "candidate_label": "Gender psychology", "decision": "included",
  "reason": "ANZSRC 2020 FoR code 520502 is a substantive research field under Social and personality psychology; no adjacent-classification equivalence is asserted.",
  "target_entity_id": "gender-psychology",
  "status": "retrieved", "publishable": false, "provenance": "reference_system"
}
