{
  "id": "anzsrc-2020-for-520599", "record_type": "coverage", "reference_system_id": "anzsrc-2020-for-psychology-fields",
  "candidate_id": "anzsrc-520599", "candidate_label": "Social and personality psychology not elsewhere classified", "decision": "excluded",
  "reason": "ANZSRC 520599 is a not-elsewhere-classified residual bucket, not a coherent psychological entity; it remains recorded for complete source coverage.",
  "status": "retrieved", "publishable": false, "provenance": "reference_system"
}
