{
  "id": "apa-coa-serious-mental-illness-psychology",
  "record_type": "coverage",
  "reference_system_id": "apa-coa-postdoctoral-specialty-practice-areas",
  "candidate_id": "serious-mental-illness-psychology",
  "candidate_label": "Serious Mental Illness Psychology",
  "decision": "included",
  "reason": "Explicitly listed in APA CoA Implementing Regulation C-5 P as currently meeting the provisions for a recognized specialty practice area.",
  "target_entity_id": "serious-mental-illness-psychology",
  "status": "retrieved",
  "publishable": false,
  "provenance": "reference_system"
}
