{
  "id": "iaap-active-divisions-08",
  "record_type": "coverage",
  "reference_system_id": "iaap-active-divisions",
  "candidate_id": "iaap-division-08",
  "candidate_label": "Health Psychology",
  "decision": "pending",
  "reason": "Registered from the complete IAAP active-division inventory; identity with the existing ANZSRC Health psychology entity remains to be adjudicated.",
  "status": "retrieved",
  "publishable": false,
  "provenance": "reference_system"
}
