{
  "id": "anzsrc-2020-for-4514", "record_type": "coverage", "reference_system_id": "anzsrc-2020-for-indigenous-studies-groups",
  "candidate_id": "anzsrc-4514", "candidate_label": "Pacific Peoples education", "decision": "included",
  "reason": "Included as a Pacific Peoples context domain, not a psychology subfield; it supplies the educational context needed for educational and developmental psychology.",
  "target_entity_id": "pacific-peoples-education",
  "status": "retrieved", "publishable": false, "provenance": "reference_system"
}
