{
  "id": "wikipedia-cognitive-biases-core-sunk-cost-effect",
  "record_type": "coverage",
  "reference_system_id": "wikipedia-cognitive-biases-core",
  "candidate_id": "wcb-sunk-cost-effect",
  "candidate_label": "Sunk cost effect",
  "decision": "included",
  "reason": "Included as a distinct named cognitive-bias identity in the bounded discovery-seed batch; no existing entity represents this phenomenon, so a new phenomenon identity is created without any evidence claim.",
  "target_entity_id": "sunk-cost-effect",
  "status": "retrieved",
  "publishable": false,
  "provenance": "reference_system"
}
