{
  "id": "anzsrc-2020-for-520108",
  "record_type": "coverage",
  "reference_system_id": "anzsrc-2020-for-psychology-fields",
  "candidate_id": "anzsrc-520108",
  "candidate_label": "Testing, assessment and psychometrics",
  "decision": "included",
  "reason": "ANZSRC 2020 FoR code 520108 is a substantive methodological field and is not coerced into a school or therapy type.",
  "target_entity_id": "testing-assessment-and-psychometrics",
  "status": "retrieved",
  "publishable": false,
  "provenance": "reference_system"
}
