{
  "id": "anzsrc-2020-for-520203", "record_type": "coverage", "reference_system_id": "anzsrc-2020-for-psychology-fields",
  "candidate_id": "anzsrc-520203", "candidate_label": "Cognitive neuroscience", "decision": "pending",
  "reason": "Recorded from the complete ANZSRC field inventory; entity type and cross-system identity remain to be adjudicated in the 5202 batch.",
  "status": "retrieved", "publishable": false, "provenance": "reference_system"
}
