{
  "id": "iaap-active-divisions-18",
  "record_type": "coverage",
  "reference_system_id": "iaap-active-divisions",
  "candidate_id": "iaap-division-18",
  "candidate_label": "History of Applied Psychology",
  "decision": "pending",
  "reason": "Registered from the complete IAAP active-division inventory; entity type and scope remain to be adjudicated.",
  "status": "retrieved",
  "publishable": false,
  "provenance": "reference_system"
}
