{
  "id": "iaap-active-divisions-10",
  "record_type": "coverage",
  "reference_system_id": "iaap-active-divisions",
  "candidate_id": "iaap-division-10",
  "candidate_label": "Psychology, Law and Ethics",
  "decision": "pending",
  "reason": "Registered from the complete IAAP active-division inventory; the compound organizational category requires adjudication.",
  "status": "retrieved",
  "publishable": false,
  "provenance": "reference_system"
}
