{
  "id": "iaap-active-divisions-17",
  "record_type": "coverage",
  "reference_system_id": "iaap-active-divisions",
  "candidate_id": "iaap-division-17",
  "candidate_label": "Professional Practice",
  "decision": "pending",
  "reason": "Registered from the complete IAAP active-division inventory; whether this professional-function division represents an atlas entity remains to be adjudicated.",
  "status": "retrieved",
  "publishable": false,
  "provenance": "reference_system"
}
