{
  "id": "anzsrc-2020-for-5205",
  "record_type": "coverage",
  "reference_system_id": "anzsrc-2020-for-psychology-groups",
  "candidate_id": "anzsrc-5205",
  "candidate_label": "Social and personality psychology",
  "decision": "included",
  "reason": "ANZSRC 2020 FoR code 5205 is an explicit group under Division 52 Psychology.",
  "target_entity_id": "social-and-personality-psychology",
  "status": "retrieved",
  "publishable": false,
  "provenance": "reference_system"
}
