{
  "id": "named-effects-routing-pilot-misattribution-of-arousal",
  "record_type": "coverage",
  "reference_system_id": "named-effects-routing-pilot",
  "candidate_id": "nep-misattribution-of-arousal",
  "candidate_label": "Misattribution of arousal",
  "decision": "included",
  "reason": "Included as a distinct named lab-effect identity for the evidence-routing pilot; no existing entity represents it, so a new phenomenon identity is created without any evidence claim.",
  "target_entity_id": "misattribution-of-arousal",
  "status": "retrieved",
  "publishable": false,
  "provenance": "reference_system"
}
